{
  "$schema": "http://json-schema.org/draft-07/schema#",
  "$id": "urn:pulso:v3:history-entry:1",
  "title": "Pulso v3 history-entry",
  "type": "object",
  "additionalProperties": false,
  "properties": {
    "schemaVersion": {
      "const": 1
    },
    "closureId": {
      "type": "string",
      "minLength": 1
    },
    "workId": {
      "type": "string",
      "pattern": "^[A-Za-z0-9][A-Za-z0-9_-]{0,79}$"
    },
    "cycle": {
      "type": "integer",
      "minimum": 1
    },
    "title": {
      "type": "string",
      "minLength": 1
    },
    "objective": {
      "type": "string",
      "minLength": 1
    },
    "createdAt": {
      "type": "string",
      "format": "date-time"
    },
    "closedAt": {
      "type": "string",
      "format": "date-time"
    },
    "outcome": {
      "enum": [
        "done",
        "cancelled"
      ]
    },
    "summary": {
      "type": "string",
      "minLength": 1
    },
    "limitations": {
      "type": "array",
      "items": {
        "type": "string",
        "minLength": 1
      },
      "minItems": 0
    },
    "evidenceIds": {
      "type": "array",
      "items": {
        "type": "string",
        "pattern": "^[A-Za-z0-9][A-Za-z0-9_-]{0,79}$"
      },
      "minItems": 0
    },
    "workPath": {
      "type": "string",
      "minLength": 1,
      "pattern": "^(?!/)(?!.*\\\\)(?!.*(?:^|/)\\.\\.(?:/|$))(?![A-Za-z]:)[^\\u0000]+$"
    }
  },
  "required": [
    "schemaVersion",
    "closureId",
    "workId",
    "cycle",
    "title",
    "objective",
    "createdAt",
    "closedAt",
    "outcome",
    "summary",
    "limitations",
    "evidenceIds",
    "workPath"
  ]
}
