{
  "schemaVersion": 1,
  "closureId": "EXAMPLE-1:c1",
  "workId": "EXAMPLE-1",
  "cycle": 1,
  "title": "Ejemplo de cierre; no es un trabajo real",
  "objective": "Resultado observable de ejemplo",
  "createdAt": "2026-09-29T00:00:00.000Z",
  "closedAt": "2026-09-29T00:00:00.000Z",
  "outcome": "cancelled",
  "summary": "Ejemplo de cancelación, sin afirmar verificación de producto",
  "limitations": [
    "Ejemplo de estructura; no añadir al historial real."
  ],
  "evidenceIds": [],
  "workPath": ".pulso/work/EXAMPLE-1/work.json"
}
